{"analysis":{"ignored_directories":[".cache",".git",".hg",".mypy_cache",".next",".nuxt",".pytest_cache",".svn",".tmp",".tox",".venv","__MACOSX","__pycache__","bower_components","build","cache","coverage","dist","node_modules","out","temp","tmp","vendor","venv"],"languages":["c","cpp","csharp","go","java","javascript","php","python","rust","typescript"],"max_ast_nodes":1000000,"max_file_bytes":1048576,"max_parsed_files":20000,"max_total_ast_nodes":10000000,"parse_timeout_ms":5000},"analysis_run_id":"01k6p0a1b2c3d4e5f6g7h8j9km","contract_version":"1.0","diagnostics":{"duration_ms":17,"replayed":false},"findings":{"by_rule":{"complexity/cyclomatic":0,"parse/syntax-error":1,"structure/class-length":0,"structure/function-length":0,"structure/nesting-depth":0,"structure/parameter-count":0},"items":[{"column":0,"line":1,"message":"File has 1 syntax error node(s) and was not measured.","path":"src/broken.js","rule_id":"parse/syntax-error","severity":"medium","threshold":null,"value":1}],"total":1,"truncated":false},"ir":{"files":[{"extension":".md","language":null,"lines":null,"parse":null,"path":"README.md","size_bytes":10,"skip_reason":"unsupported_language","structure":null},{"extension":".php","language":"php","lines":12,"parse":{"ast_max_depth":11,"ast_nodes":93,"error_nodes":0,"first_error":null,"limit":null,"status":"PARSED"},"path":"src/Café.php","size_bytes":223,"skip_reason":null,"structure":{"functions":[{"column":4,"complexity":4,"end_line":11,"kind":"method","line":7,"max_nesting":1,"name":"total","parameters":2,"parent_type":0,"visibility":"public"}],"imports":[{"line":3,"target":"App\\Models\\Invoice"}],"lines":{"blank":0,"code":11,"comment":1,"total":12},"types":[{"bases":["Base"],"column":0,"end_line":12,"kind":"class","line":5,"methods":1,"name":"Café","visibility":null}]}},{"extension":".js","language":"javascript","lines":1,"parse":{"ast_max_depth":3,"ast_nodes":4,"error_nodes":1,"first_error":{"column":0,"line":1},"limit":null,"status":"PARSE_ERROR"},"path":"src/broken.js","size_bytes":11,"skip_reason":null,"structure":null},{"extension":".py","language":"python","lines":7,"parse":{"ast_max_depth":9,"ast_nodes":48,"error_nodes":0,"first_error":null,"limit":null,"status":"PARSED"},"path":"src/util.py","size_bytes":112,"skip_reason":null,"structure":{"functions":[{"column":0,"complexity":5,"end_line":5,"kind":"function","line":1,"max_nesting":2,"name":"avg","parameters":3,"parent_type":null,"visibility":null},{"column":6,"complexity":1,"end_line":7,"kind":"anonymous","line":7,"max_nesting":0,"name":null,"parameters":1,"parent_type":null,"visibility":null}],"imports":[],"lines":{"blank":1,"code":6,"comment":0,"total":7},"types":[]}}],"version":"1.1"},"languages":[{"bytes":11,"files":1,"language":"javascript","lines":1},{"bytes":223,"files":1,"language":"php","lines":12},{"bytes":112,"files":1,"language":"python","lines":7}],"metrics":{"by_language":{"javascript":{"anonymous_functions":0,"ast_max_depth":null,"ast_nodes":0,"complexity_avg":null,"complexity_max":null,"complexity_over_threshold":0,"complexity_threshold":10,"complexity_total":0,"files_analyzable":1,"files_limit_exceeded":0,"files_parse_error":1,"files_parse_timeout":0,"files_parsed":0,"files_unsupported_parser":0,"function_lines_avg":null,"function_lines_max":null,"functions":0,"functions_total":0,"imports":0,"lines_blank":0,"lines_code":0,"lines_comment":0,"lines_total":0,"methods":0,"nesting_avg":null,"nesting_max":null,"parameters_avg":null,"parameters_max":null,"types":0,"types_by_kind":{},"types_with_bases":0,"unsupported":[]},"php":{"anonymous_functions":0,"ast_max_depth":11,"ast_nodes":93,"complexity_avg":4.0,"complexity_max":4,"complexity_over_threshold":0,"complexity_threshold":10,"complexity_total":4,"files_analyzable":1,"files_limit_exceeded":0,"files_parse_error":0,"files_parse_timeout":0,"files_parsed":1,"files_unsupported_parser":0,"function_lines_avg":5.0,"function_lines_max":5,"functions":0,"functions_total":1,"imports":1,"lines_blank":0,"lines_code":11,"lines_comment":1,"lines_total":12,"methods":1,"nesting_avg":1.0,"nesting_max":1,"parameters_avg":2.0,"parameters_max":2,"types":1,"types_by_kind":{"class":1},"types_with_bases":1,"unsupported":[]},"python":{"anonymous_functions":1,"ast_max_depth":9,"ast_nodes":48,"complexity_avg":3.0,"complexity_max":5,"complexity_over_threshold":0,"complexity_threshold":10,"complexity_total":6,"files_analyzable":1,"files_limit_exceeded":0,"files_parse_error":0,"files_parse_timeout":0,"files_parsed":1,"files_unsupported_parser":0,"function_lines_avg":3.0,"function_lines_max":5,"functions":1,"functions_total":2,"imports":0,"lines_blank":1,"lines_code":6,"lines_comment":0,"lines_total":7,"methods":0,"nesting_avg":1.0,"nesting_max":2,"parameters_avg":2.0,"parameters_max":3,"types":0,"types_by_kind":{},"types_with_bases":0,"unsupported":[]}},"overall":{"anonymous_functions":1,"ast_max_depth":11,"ast_nodes":141,"complexity_avg":3.3333,"complexity_max":5,"complexity_over_threshold":0,"complexity_threshold":10,"complexity_total":10,"files_analyzable":3,"files_limit_exceeded":0,"files_parse_error":1,"files_parse_timeout":0,"files_parsed":2,"files_unsupported_parser":0,"function_lines_avg":3.6667,"function_lines_max":5,"functions":1,"functions_total":3,"imports":1,"lines_blank":1,"lines_code":17,"lines_comment":1,"lines_total":19,"methods":1,"nesting_avg":1.0,"nesting_max":2,"parameters_avg":2.0,"parameters_max":3,"types":1,"types_by_kind":{"class":1},"types_with_bases":1,"unsupported":[]},"version":"1.0"},"parsing":{"files":{"LIMIT_EXCEEDED":0,"PARSED":2,"PARSE_ERROR":1,"PARSE_TIMEOUT":0,"UNSUPPORTED_PARSER":0},"languages":[{"files":{"LIMIT_EXCEEDED":0,"PARSED":0,"PARSE_ERROR":1,"PARSE_TIMEOUT":0,"UNSUPPORTED_PARSER":0},"language":"javascript"},{"files":{"LIMIT_EXCEEDED":0,"PARSED":1,"PARSE_ERROR":0,"PARSE_TIMEOUT":0,"UNSUPPORTED_PARSER":0},"language":"php"},{"files":{"LIMIT_EXCEEDED":0,"PARSED":1,"PARSE_ERROR":0,"PARSE_TIMEOUT":0,"UNSUPPORTED_PARSER":0},"language":"python"}]},"request_id":"255e77b8-6b64-4c7e-927d-893486b185ab","result_hash":"1e876c92eb64e0e1a386abdc373004edc9640ee63539d91aa45ece89745ad02a","result_type":"static_analysis","source":{"bytes_total":356,"files_analyzed":3,"files_skipped":{"binary":0,"ignored_path":0,"too_large":0,"unsupported_language":1},"files_total":4,"sha256":"0a4a75e9950d1ac3c656206501b572135fa0cf1606ba5be38b38b44a0fd53065","size_bytes":695},"versions":{"analyzer":"0.2.0","ir":"1.1","metrics":"1.0","parser_runtime":"tree-sitter@0.25.2","parsers":{"c":"tree-sitter-c@0.24.2","cpp":"tree-sitter-cpp@0.23.4","csharp":"tree-sitter-c-sharp@0.23.5","go":"tree-sitter-go@0.25.0","java":"tree-sitter-java@0.23.5","javascript":"tree-sitter-javascript@0.25.0","php":"tree-sitter-php@0.24.1","python":"tree-sitter-python@0.25.0","rust":"tree-sitter-rust@0.24.2","typescript":"tree-sitter-typescript@0.23.2"},"scoring":null}}